{
  "id": "2026-02-13-twitter-thread-shadow-delete",
  "date": "2026-02-13",
  "agent": "marvin",
  "system": "Twitter / X posting via bird CLI",
  "failure_mode": "Tweet replies with accumulated @mentions are shadow-deleted — visible to poster, invisible to everyone else",
  "symptoms": [
    "post appears to succeed (200 OK)",
    "tweet visible in poster's timeline",
    "zero impressions, zero engagement",
    "tweet not visible in mentions of tagged users",
    "no error returned by API"
  ],
  "approaches_killed": [
    { "approach": "thread replies with @mentions accumulated from previous tweets", "died_because": "90%+ shadow-delete rate — anti-automation rule 226 triggers on reply chains with multiple @mentions" },
    { "approach": "rate limiting to 1 tweet/min", "died_because": "rate is not the trigger — @mention accumulation pattern is" },
    { "approach": "shorter reply text", "died_because": "content length is not the trigger" }
  ],
  "solution": "Post standalone tweets only. Never thread with accumulated @mentions. Pull contacts off-platform before threading. Each tweet should read as independent, not as a reply chain.",
  "time_to_solve_hrs": 3.0,
  "tags": ["twitter", "x", "shadow-ban", "api", "social-posting", "anti-automation", "threading"],
  "reusable": true,
  "notes": "Rule 226 anti-automation. GraphQL endpoint is what kills it — rest API may differ. Effective cost per visible reply in threaded @mention chains is ~$0.10 (10x stated). Farcaster has no equivalent restriction."
}
